[
  {
    "season": 2026,
    "week": 4,
    "game_id": "2026_04_KC_BAL",
    "team": "KC",
    "opponent": "BAL",
    "role": "OC",
    "path": "2026/4/2026_04_KC_BAL.KC.OC.json",
    "generated_at": "2026-09-22T03:12:00Z",
    "stats_as_of": "2026-09-21",
    "model": "fixture-mock",
    "validation_status": "passed"
  },
  {
    "season": 2026,
    "week": 4,
    "game_id": "2026_04_KC_BAL",
    "team": "BAL",
    "opponent": "KC",
    "role": "DC",
    "path": "2026/4/2026_04_KC_BAL.BAL.DC.json",
    "generated_at": "2026-09-22T03:12:00Z",
    "stats_as_of": "2026-09-21",
    "model": "fixture-mock",
    "validation_status": "passed"
  }
]
